{
  "template_id": "retail_shop",
  "name": "Retail shop",
  "description": "Point-of-sale revenue, rent, inventory COGS, and seasonal patterns for a brick-and-mortar retail store.",
  "suggested_initial_balance": 25000.0,
  "suggested_base_currency": "USD",
  "entries": [
    {
      "entry_type": "income",
      "name": "In-store POS revenue",
      "date_pattern": "01..",
      "amount": 35000.0,
      "currency": "USD",
      "category": "revenue",
      "is_active": true
    },
    {
      "entry_type": "income",
      "name": "Online sales",
      "date_pattern": "15..",
      "amount": 8000.0,
      "currency": "USD",
      "category": "revenue",
      "is_active": true
    },
    {
      "entry_type": "income",
      "name": "Holiday season uplift (annual)",
      "date_pattern": "1.12.",
      "amount": 15000.0,
      "currency": "USD",
      "category": "revenue",
      "is_active": true
    },
    {
      "entry_type": "expense",
      "name": "Store rent",
      "date_pattern": "01..",
      "amount": 5500.0,
      "currency": "USD",
      "category": "facilities",
      "is_active": true
    },
    {
      "entry_type": "expense",
      "name": "Inventory COGS",
      "date_pattern": "01..",
      "amount": 18000.0,
      "currency": "USD",
      "category": "cogs",
      "is_active": true
    },
    {
      "entry_type": "expense",
      "name": "Payroll — store staff",
      "date_pattern": "01..",
      "amount": 12000.0,
      "currency": "USD",
      "category": "payroll",
      "is_active": true
    },
    {
      "entry_type": "expense",
      "name": "Utilities",
      "date_pattern": "15..",
      "amount": 800.0,
      "currency": "USD",
      "category": "utilities",
      "is_active": true
    },
    {
      "entry_type": "expense",
      "name": "POS & payment processing",
      "date_pattern": "01..",
      "amount": 299.0,
      "currency": "USD",
      "category": "software",
      "is_active": true
    },
    {
      "entry_type": "expense",
      "name": "Annual business license",
      "date_pattern": "1.3.",
      "amount": 1200.0,
      "currency": "USD",
      "category": "licenses",
      "is_active": true
    },
    {
      "entry_type": "expense",
      "name": "Store renovation (one-time)",
      "date_pattern": "15.6.2026",
      "amount": 25000.0,
      "currency": "USD",
      "category": "capex",
      "is_active": true
    },
    {
      "entry_type": "expense",
      "name": "Holiday marketing campaign (annual)",
      "date_pattern": "1.11.",
      "amount": 5000.0,
      "currency": "USD",
      "category": "marketing",
      "is_active": true
    }
  ]
}
