{
  "template_id": "consulting_firm",
  "name": "Consulting firm",
  "description": "Client retainers, contractor costs, and operating expenses for a small professional services firm.",
  "suggested_initial_balance": 35000.0,
  "suggested_base_currency": "USD",
  "entries": [
    {
      "entry_type": "income",
      "name": "Client retainer — Account A",
      "date_pattern": "01..",
      "amount": 15000.0,
      "currency": "USD",
      "category": "revenue",
      "is_active": true
    },
    {
      "entry_type": "income",
      "name": "Client retainer — Account B",
      "date_pattern": "01..",
      "amount": 12000.0,
      "currency": "USD",
      "category": "revenue",
      "is_active": true
    },
    {
      "entry_type": "income",
      "name": "Project-based fees",
      "date_pattern": "15..",
      "amount": 8000.0,
      "currency": "USD",
      "category": "revenue",
      "is_active": true
    },
    {
      "entry_type": "income",
      "name": "Training workshops (annual)",
      "date_pattern": "1.6.",
      "amount": 24000.0,
      "currency": "USD",
      "category": "revenue",
      "is_active": true
    },
    {
      "entry_type": "expense",
      "name": "Contractor & subcontractor costs",
      "date_pattern": "15..",
      "amount": 18000.0,
      "currency": "USD",
      "category": "subcontractors",
      "is_active": true
    },
    {
      "entry_type": "expense",
      "name": "Office lease",
      "date_pattern": "01..",
      "amount": 4500.0,
      "currency": "USD",
      "category": "facilities",
      "is_active": true
    },
    {
      "entry_type": "expense",
      "name": "Payroll — staff salaries",
      "date_pattern": "01..",
      "amount": 22000.0,
      "currency": "USD",
      "category": "payroll",
      "is_active": true
    },
    {
      "entry_type": "expense",
      "name": "Tax reserve (estimated)",
      "date_pattern": "15..",
      "amount": 8000.0,
      "currency": "USD",
      "category": "taxes",
      "is_active": true
    },
    {
      "entry_type": "expense",
      "name": "Business insurance (annual)",
      "date_pattern": "1.1.",
      "amount": 4800.0,
      "currency": "USD",
      "category": "insurance",
      "is_active": true
    },
    {
      "entry_type": "expense",
      "name": "Software & collaboration tools",
      "date_pattern": "01..",
      "amount": 600.0,
      "currency": "USD",
      "category": "software",
      "is_active": true
    },
    {
      "entry_type": "expense",
      "name": "Travel & client expenses",
      "date_pattern": "01..",
      "amount": 1500.0,
      "currency": "USD",
      "category": "travel",
      "is_active": true
    }
  ]
}
